{
  "eventId": "2fbc3b4c-7ec1-4eb6-a6b7-6ebae174d001",
  "eventType": "WarningRaised",
  "schemaVersion": "1.0",
  "occurredAt": "2026-09-17T08:30:00Z",
  "sourceMember": "MEMBER_B",
  "traceId": "trace-20260917-001",
  "payload": {
    "warningId": "WARN-20260917-0001",
    "equipmentId": "EQ-000001",
    "riskLevel": "HIGH",
    "healthScore": 42.5,
    "suspectedFault": "主轴轴承振动异常",
    "warningAt": "2026-09-17T08:29:55Z",
    "modelVersion": "health-model-1.3.0"
  }
}
